{"indicator":"x_manf","lattice":{"golden_angle_deg":137.50776,"rule":"vogel","slot_area":1},"method":"capacity-constrained power assignment on a Vogel lattice (design/sketches/territories.py) plus a count-preserving contiguity repair; iterations 600 cold, 200 warm","price_basis":null,"rounding":"slots = max(1, floor(population / 1e6 + 0.5)) per country (half-up); population = published panel_income value of that year","schema_version":"v1","seed":20261010,"source":{"panel_income_sha256":"56a4bb01c454752567d645a67e889c1f6534126c1d346aa4d673bdfe4b862da2","population_indicator":"population","values_decimals":0},"tags":{"layout":"DERIVED"},"unit_people":1000000,"years":[{"area_scale":[0.335,0.3542,1.0039,0.9594,0.997,1.0055,0.9597,0.9951,0.932,0.9792,0.951,0.9973,0.9983,1.0043,1.0013,0.9967,1.0045,0.9966,0.9985,1.0088,1.0157,1.0,1.0406,0.8785,1.0003,1.0588,0.9952,1.0282,0.9968,0.989,0.7884,0.9907,1.0197,1.022,1.001,0.9055,0.9978,0.9973,1.0604,1.0137,0.7733,0.9953,1.1099,1.0038,1.0046,0.1481,0.9914,1.0089,1.0336,1.0302,0.2548,0.0477,0.8424,0.882,0.9546,1.0474,0.0556,0.0749,0.9689],"connectivity":{"below_95":0,"mean":1.0,"min":1.0},"counts":[1,1,123,7,43,79,8,57,5,7,9,5,10,57,116,112,58,39,250,23,3,865,8,4,56,1,55,5,15,28,1,18,10,16,149,4,83,184,4,10,1,23,3,17,12,1,20,4,13,11,1,1,2,2,10,10,1,1,12],"median_person":{"iso3":"IND","value":70.08},"n":59,"no_data":[{"iso3":"ABW","population":62753.0},{"iso3":"AFG","population":12045660.0},{"iso3":"ALB","population":3286542.0},{"iso3":"AND","population":52597.0},{"iso3":"ARE","population":1898220.0},{"iso3":"ARG","population":32755901.0},{"iso3":"ARM","population":3552128.0},{"iso3":"ASM","population":46640.0},{"iso3":"ATG","population":63066.0},{"iso3":"AZE","population":7175200.0},{"iso3":"BDI","population":5587052.0},{"iso3":"BEL","population":9967379.0},{"iso3":"BEN","population":5281479.0},{"iso3":"BFA","population":9159356.0},{"iso3":"BGR","population":8718289.0},{"iso3":"BHR","population":514797.0},{"iso3":"BHS","population":275945.0},{"iso3":"BIH","population":4448652.0},{"iso3":"BLR","population":10189348.0},{"iso3":"BLZ","population":183076.0},{"iso3":"BMU","population":57559.0},{"iso3":"BOL","population":7130142.0},{"iso3":"BRB","population":258582.0},{"iso3":"BRN","population":255292.0},{"iso3":"BTN","population":589287.0},{"iso3":"BWA","population":1305696.0},{"iso3":"CAF","population":2871910.0},{"iso3":"CHI","population":143087.0},{"iso3":"CHN","population":1135185000.0},{"iso3":"CIV","population":12189778.0},{"iso3":"COD","population":36684063.0},{"iso3":"COG","population":2380560.0},{"iso3":"COL","population":32440069.0},{"iso3":"COM","population":444596.0},{"iso3":"CPV","population":375428.0},{"iso3":"CRI","population":3121706.0},{"iso3":"CUB","population":10631799.0},{"iso3":"CUW","population":145400.0},{"iso3":"CYM","population":25999.0},{"iso3":"CZE","population":10333355.0},{"iso3":"DJI","population":579538.0},{"iso3":"DMA","population":69627.0},{"iso3":"DOM","population":7151166.0},{"iso3":"DZA","population":25375810.0},{"iso3":"EGY","population":58396618.0},{"iso3":"ERI","population":2032737.0},{"iso3":"EST","population":1569174.0},{"iso3":"ETH","population":47609755.0},{"iso3":"FSM","population":100888.0},{"iso3":"GAB","population":983734.0},{"iso3":"GEO","population":4802000.0},{"iso3":"GHA","population":15394648.0},{"iso3":"GIB","population":27200.0},{"iso3":"GIN","population":6434374.0},{"iso3":"GMB","population":1054696.0},{"iso3":"GNB","population":973669.0},{"iso3":"GNQ","population":474274.0},{"iso3":"GRD","population":99957.0},{"iso3":"GTM","population":9024773.0},{"iso3":"GUM","population":138610.0},{"iso3":"GUY","population":749894.0},{"iso3":"HKG","population":5704500.0},{"iso3":"HND","population":4980488.0},{"iso3":"HRV","population":4777368.0},{"iso3":"HUN","population":10373988.0},{"iso3":"IMN","population":68916.0},{"iso3":"IRN","population":58380092.0},{"iso3":"IRQ","population":17581206.0},{"iso3":"JAM","population":2379877.0},{"iso3":"KAZ","population":17154054.0},{"iso3":"KGZ","population":4391236.0},{"iso3":"KHM","population":7374752.0},{"iso3":"KNA","population":40432.0},{"iso3":"LAO","population":4311955.0},{"iso3":"LBN","population":3595175.0},{"iso3":"LBR","population":2223667.0},{"iso3":"LBY","population":4445239.0},{"iso3":"LCA","population":137857.0},{"iso3":"LIE","population":28742.0},{"iso3":"LSO","population":1809696.0},{"iso3":"LTU","population":3697838.0},{"iso3":"LUX","population":381850.0},{"iso3":"LVA","population":2663151.0},{"iso3":"MAF","population":28224.0},{"iso3":"MAR","population":24375551.0},{"iso3":"MCO","population":30358.0},{"iso3":"MDA","population":2977912.0},{"iso3":"MDV","population":224762.0},{"iso3":"MHL","population":44629.0},{"iso3":"MKD","population":2063689.0},{"iso3":"MLI","population":9178830.0},{"iso3":"MMR","population":39817251.0},{"iso3":"MNE","population":606372.0},{"iso3":"MNG","population":2098710.0},{"iso3":"MNP","population":43342.0},{"iso3":"MOZ","population":13094537.0},{"iso3":"MRT","population":1951878.0},{"iso3":"NAM","population":1369303.0},{"iso3":"NCL","population":176456.0},{"iso3":"NER","population":8286059.0},{"iso3":"NGA","population":97120925.0},{"iso3":"NIC","population":4162559.0},{"iso3":"NPL","population":19524573.0},{"iso3":"NRU","population":9622.0},{"iso3":"PAN","population":2455583.0},{"iso3":"PER","population":22014771.0},{"iso3":"PHL","population":62854666.0},{"iso3":"PLW","population":15259.0},{"iso3":"PNG","population":3896481.0},{"iso3":"POL","population":38110782.0},{"iso3":"PRI","population":3537000.0},{"iso3":"PRK","population":21112137.0},{"iso3":"PSE","population":1978248.0},{"iso3":"PYF","population":203776.0},{"iso3":"QAT","population":440175.0},{"iso3":"RUS","population":147969406.0},{"iso3":"RWA","population":7375307.0},{"iso3":"SAU","population":10640691.0},{"iso3":"SDN","population":22021481.0},{"iso3":"SEN","population":7720523.0},{"iso3":"SLB","population":331435.0},{"iso3":"SLE","population":4196828.0},{"iso3":"SLV","population":5399726.0},{"iso3":"SMR","population":23475.0},{"iso3":"SOM","population":7082811.0},{"iso3":"SRB","population":7897937.0},{"iso3":"SSD","population":4737633.0},{"iso3":"STP","population":122980.0},{"iso3":"SUR","population":412493.0},{"iso3":"SVK","population":5299187.0},{"iso3":"SVN","population":1998161.0},{"iso3":"SWZ","population":872428.0},{"iso3":"SXM","population":28061.0},{"iso3":"SYC","population":69507.0},{"iso3":"SYR","population":12579208.0},{"iso3":"TCA","population":11688.0},{"iso3":"TCD","population":5982833.0},{"iso3":"TGO","population":3714021.0},{"iso3":"TJK","population":5398768.0},{"iso3":"TKM","population":3760562.0},{"iso3":"TLS","population":760345.0},{"iso3":"TON","population":99700.0},{"iso3":"TTO","population":1252208.0},{"iso3":"TUV","population":8798.0},{"iso3":"TZA","population":26110207.0},{"iso3":"UGA","population":17569897.0},{"iso3":"UKR","population":52054092.0},{"iso3":"URY","population":3104403.0},{"iso3":"UZB","population":20464956.0},{"iso3":"VCT","population":111812.0},{"iso3":"VGB","population":15704.0},{"iso3":"VIR","population":103963.0},{"iso3":"VNM","population":65504552.0},{"iso3":"WSM","population":169042.0},{"iso3":"XKX","population":1973790.0},{"iso3":"YEM","population":13887862.0},{"iso3":"ZAF","population":40746268.0},{"iso3":"ZMB","population":7786169.0}],"order":["MAC","MLT","JPN","CHE","KOR","DEU","AUT","ITA","ISR","HTI","SWE","FIN","PRT","GBR","PAK","BGD","FRA","ESP","USA","ROU","SGP","IND","TUN","IRL","TUR","MUS","THA","DNK","NLD","CAN","CYP","MYS","GRC","LKA","BRA","JOR","MEX","IDN","NOR","ZWE","FJI","KEN","NZL","AUS","MDG","VUT","VEN","PRY","CHL","CMR","ISL","FRO","KWT","OMN","MWI","ECU","GRL","KIR","AGO"],"owner":"FRUVFRUVFRUVFRUVFRUVFRUVFRUVFRUVFRUVFRUVFRUVBRUVFRUCFRUFFRUVFQIVFQUVAhUVBRUVFRUCFRUFFQIVFQUVFQUVAhUVBRUCFRUCFRUFFQIVFQUVFQUVAhUVBRUCFRUCFRUFFQIVFQUVAgUVAhUVBRUCFRUFFRUFFQIVFQUVAhUVAhUVBRUCFRUFFQIFFQIVFQUVAhUVAhUVBRUCFRUFFQIFFQIVFQUVAhUVBRUCBRUCFRUFFQIFFQIVFQUVAhUVBRUCBRUCFRUFFQIVFQIVFQUVAhUVBRUCBRUCFRUFFQIVFQUVAgUVAhUVBRUCCBUCFRUFFQIVFQUVAgUVAhUVBRUCFRUCFQMFFQIVFQUVAggVAhUVBRUCFRUFFQIFFQIVFQUVAggVAhUDBRUCFRUFFQIFFQIVFQUVAhUVDxUDBRUCFRUFFQIIFQIVAwUVAhUVBRUCBRUCFRUFFQIIFQ8VAwUVAhUVBRUCChUCFRUFFQIVFQ8VBgUVAhUVBRUCChUPFQMFFQIVFQUVAgoVAhUVBRUCDRUPFQYFFQIVFQUVAgoVDxUDBRUCFRUPFQYKFQIVFQUVAg0VDxUQBRUCFRUPFQIKFQIVEAUVAg0VDxUGEhUCFRUFFQINFQ8VEBIVAhUVDxUGChUCFRUFFQINFQ8VEBIVAhUVDxUCChUPFRASFQINFQ8VBhIVAhUVBRUCDRUPFRASFQIVFQ8VBgoVAhULEhUCDRUPFRASFQIVFQ8VAg0VDxUQEhUCDRUPFQYSFQIVCxIVAg0VDxUQEhUCFRUPFQINFQ8VEBIVAg0VDxUQEhUCFRUPFQ4NFQ8VEBIVAg0VDxUAEhUPFQsSFQINFQ8VEBIVAhUVDxUODRUPFRASFQINFQ8VEBIVAhULEhUODRUPFRASFQINFQ8VDhIVDxUQEhUCDRUPFRASFQIVFQ8VDg0VDxUQEhUCDRUPFQESFQ8VCxIVDg0VDxUQEhUCDRUPFQ4SFQ8VEBIVAg0VDxUQEhURFSUSFQ4NFQ8VEBIVAg0VDxUOEhUPFRASFQ4NFQ8VEBIVERUlDxUODRUPFRASFQINFQ8VEBIVERUlEhUODRUPFRASFRENFQ8VDhIVDxUQEhUODRUPFRASFREVJRIVDg0VDxUQEhURDRUPFQ4SFQ8VEBIVDg0VDxUQEhURFSUPFQ4SFQ8VEBIVDg0VDxUQEhURFSUSFQ4NFQ8VEBIVESIlDxUOEhUPFRASFQ4NFQ8VEBIVESIlEhUODRUPFRASFRENFQ8VDhIVERUlEhUODRUPFRASFREiJQ8VDhIVDxUQEhUODRUPFRASFREiJRIVDg0VDxUQEhURIiUPFQ4SFQcVJRIVDg0VDxUQEhURIiUPFQ4SFQ8VEBIVEQ0VDxUOEhURIiUSFQ4NFQ8VEBIVESIlDxUOEhUPFRASFQ4NFQ8VEBIVESIlEhUODRUPFRASFREiJQ8VDhIVByIlEhUODRUPFRASFREiJQ8VDhIVDxUQEhUODRUPFQ4SFQciJRIVDg0VDxUQEhURIiUPFQ4SFQciJRIVDg0VDxUQEhURIiUSFQ4XFQ8VEBIVESIlDxUOEhUHIiUSFQ4NFQ8VEBIVESIlJBUOEhUHFSUSFQ4NJQ8VExIVESIlEhUOFxUPFRASFREiJQ8VDhIVByIlEhUODRUPFRASFREiJSQVDhIVBxUbEhUOIiUPFQ4SFQciJRIVDhoVDxUQEhURIiUkFQ4SFQciJRIVDholDxUTEhURIiUkFQ4XFQ8VGxIVESIlDxUOEhUHIiUSFQ4aFQ8VExIVESIlJBUOEhUHIhsSFQ4iJQ8VExIVByIlEhUOGhUPFRsSFREiJSQVDhIVByIlEhUOGhUPFRMSFREiJSQVDhcVBxUbEhUEIiUkFQ4SFQciJRIVDhoVDxUTEhURIiUkFQ4SFQciJRIVDholDxUTEhUHIiUkFQ4aFSkVGBIVBCIlJBUOEhUHIiUSFQ4aFQ8VExIVESIlJBUOEhUHIhgSFQ4iJSQVExIVByIlEhUOGhUpFRgSFREiJSQVDhIVByIlEhUOGiUpFRMSFQciJSQVDhoVBxUYEhUEIiUkFQ4SFQciJRIVDhoVKRUTEhURIiUkFQ4SFQciGBIVBBolJBUTEhUHIiUkFQ4aFSkVGBIVBCIlJBUOEhUHIiUSFQ4aJSkVExIVByIlJBUOGhUHIhgSFQQiJSQVExIVByIlEhUOGhUpFRgSFQQiJSQVDhIVByIlEhUOGiUpFRMSFQciJSQVDhoVGRUYEhUEIiUkFQ4SFQciJRIVDh